{
  "schema": "world-operation",
  "operation_id": "operation.autonomy.5c169291e16e079d7701",
  "domain": "medical_network",
  "operation_kind": "casualty_response",
  "owner_ref": "faction.konoha_hospital",
  "authority_ref": "support.hospital.akemi_hoshino",
  "opened_at": "SE-0061-06-18T07:00:00",
  "next_due_at": "SE-0061-06-25T07:00:00",
  "closed_at": null,
  "status": "pending",
  "archetype_ref": null,
  "subject_kind": "place",
  "subject_ref": "place.konoha",
  "client_ref": null,
  "place_refs": [
    "place.konoha.hospital"
  ],
  "route_refs": [],
  "opposition_refs": [],
  "resource_refs": [
    "item_field_medical_kit",
    "item_triage_tags"
  ],
  "team_refs": [],
  "participant_refs": [],
  "blocked_reason": null,
  "mission_refs": [],
  "project_refs": [],
  "case_refs": [],
  "evidence_refs": [],
  "claim_refs": [],
  "delivery_refs": [],
  "report_recipient_refs": [
    "support.hospital.akemi_hoshino"
  ],
  "progress_milli": 0,
  "success_condition": "Triage and route casualties through actual treatment capacity without creating free recovery.",
  "failure_condition": "The casualty_response objective becomes impossible, compromised, or materially incomplete.",
  "classification": "restricted",
  "result_refs": []
}
